{
  "actor": "executor-person",
  "candidate_hash": "08aacca7af812de75dd2e491cf60932e7c275f0b34211786e567ccdb3f7a98d5",
  "contract_hash": "6ebb4ef51c4ce867731cc88ef9364bbccf76eed4f5e2eb39419995609540ee2b",
  "evidence_hash": "3d45b04a542544d71c93c5ecb0e7e7fc1a062ea9be99c52a0b474615b2030b74",
  "expires_at": 1300,
  "grant_id": "grant-1",
  "issued_at": 1000,
  "kind": "grant",
  "max_calls": 10,
  "max_total_units": 100,
  "operation": "inventory.reserve",
  "resources": [
    "stock-a",
    "stock-b"
  ],
  "tenant": "demo"
}
